{
  "$schema": "https://json-schema.org/draft/2020-12/schema",
  "$id": "https://starcar.dev/schema/yard-snapshot/1",
  "title": "StarCar yard snapshot - the wire contract",
  "description": "Spec 2026-07-23-yard-board S3: THE single owner of the server-to-browser wire shape (design rev 5 D15 - cross-language seam, schema-as-constructed-header). The Go server's structs and the browser's validator BOTH conform to this file; a hand-maintained mirror anywhere is a finding. Composition SEMANTICS (most-severe-wins, age quantisation) live in the spec and its vectors; this file owns SHAPE.",
  "$defs": {
    "sseEventName": {
      "const": "yard",
      "description": "The SSE event name, exported here so server writer and client subscriber share ONE definition (design rev 5 section 5.4 item 4 - the one-character-apart failure mode is cross-language now). Tests on both sides assert against this constant."
    },
    "register": {
      "enum": ["nominal", "in-progress", "needs-attention"],
      "description": "The ONLY closed taxonomy (design rev 5 section 5.2). Severity order: nominal < in-progress < needs-attention. Growing this set is a constitution-level decision."
    },
    "vocabDef": {
      "type": "object",
      "properties": {
        "id": { "type": "string" },
        "label": { "type": "string" },
        "register": { "$ref": "#/$defs/register" }
      },
      "required": ["id", "label", "register"]
    },
    "freshness": {
      "type": "object",
      "description": "Closed by mechanism (design rev 5 section 5.2, amended #29 2026-07-26): an adapter is attached or not; if attached it has run or not; if run it succeeded or failed; if it succeeded but the data is old, something is IN FLIGHT and stalled (stale) or nothing is (idle) - a yard at rest is not stale.",
      "oneOf": [
        { "properties": { "kind": { "const": "not-applicable" } }, "required": ["kind"] },
        { "properties": { "kind": { "const": "never-polled" } }, "required": ["kind"] },
        {
          "properties": {
            "kind": { "const": "fresh" },
            "asOf": { "type": "string" }
          },
          "required": ["kind", "asOf"]
        },
        {
          "properties": {
            "kind": { "const": "stale" },
            "asOf": { "type": "string" },
            "ageBucketMs": { "type": "integer", "description": "QUANTISED server-issued age (design rule 3: the client never computes age). Included in change detection." }
          },
          "required": ["kind", "asOf", "ageBucketMs"]
        },
        {
          "properties": {
            "kind": { "const": "idle" },
            "asOf": { "type": "string" },
            "ageBucketMs": { "type": "integer", "description": "#29: same QUANTISED server-issued age mechanism as 'stale' - an idle yard still honestly discloses its age, calmly. Included in change detection, exactly like 'stale''s ageBucketMs." }
          },
          "required": ["kind", "asOf", "ageBucketMs"],
          "description": "#29: data is older than stalenessMs, but NOTHING is in flight (every dispatch has returned or is presumed-lost, or there are no dispatch subjects at all) - a yard at rest, rendered calm/nominal, never confused with a broken pipeline ('stale', reserved for old data WHILE something is in flight and not moving)."
        },
        {
          "properties": {
            "kind": { "const": "failed" },
            "reason": {
              "type": "object",
              "properties": { "code": { "type": "string" }, "detail": { "type": "string" } },
              "required": ["code", "detail"]
            },
            "lastGoodAsOf": { "type": "string" }
          },
          "required": ["kind", "reason"]
        }
      ]
    },
    "boardCondition": {
      "type": "object",
      "description": "A fault about the BOARD, rendered in chrome, distinct from yard status (design rev 5 section 6).",
      "properties": {
        "code": { "type": "string" },
        "detail": { "type": "string" },
        "register": { "$ref": "#/$defs/register" }
      },
      "required": ["code", "detail", "register"]
    },
    "lane": {
      "type": "object",
      "properties": {
        "id": { "type": "string" },
        "title": { "type": "string" },
        "position": { "type": "string", "description": "A PositionDef id from vocabularies.positions - open vocabulary, registry-owned (D11)." },
        "freshness": { "$ref": "#/$defs/freshness" },
        "data": {
          "$comment": "Shapes for the v0 lanes are pinned by $defs.trainsPayload, $defs.gatesPayload, and $defs.dispatchesPayload below (spec YB-5) - each landed red-first by the schema car (plan task 2.2). An unrecognised lane's payload is a free object the view meets with the no-renderer path, never a validation failure (Law 7); these three $defs are not $ref'd here because a lane's data shape is chosen by which lane it is, not by one closed schema union.",
          "description": "The lane payload. Shapes for the v0 lanes are pinned by the spec's payload contracts (S4) and their vectors; an unrecognised lane's payload is a free object the view meets with the no-renderer path, never a validation failure (Law 7)."
        }
      },
      "required": ["id", "title", "position", "freshness"]
    },
    "trainsPayload": {
      "type": "object",
      "description": "YB-5: the trains lane's data shape. Each car entry joins the WINNING manifest's member declaration with that subject's fold output; declaredNotObserved names members with no records (design S6).",
      "properties": {
        "trains": {
          "type": "array",
          "items": {
            "type": "object",
            "properties": {
              "id": { "type": "string", "description": "The whole train: subject - the train identity (design DR3-3; never stripped of its prefix for meaning)." },
              "title": { "type": "string" },
              "cars": {
                "type": "array",
                "items": {
                  "type": "object",
                  "properties": {
                    "subject": { "type": "string" },
                    "role": { "type": "string" },
                    "gate": { "type": "string", "description": "Present when role is gate: names WHICH gate." },
                    "state": { "type": "string" },
                    "at": { "type": "string" },
                    "outcome": { "type": "string" },
                    "superseded": { "type": "array" },
                    "recordDir": {
                      "type": "string",
                      "description": "#28 (clickable provenance): this subject's record directory, RELATIVE TO THE STORE ROOT (e.g. \"51-fix-car-r1\") - single-sourced from store.Record.Path (board/assemble's recordDirBySubject), never re-derived from subject client-side. Combine with config.githubRepoUrl/githubRef/githubArtifactsPrefix to build a full tree link. Absent when no surviving record names this subject."
                    }
                  },
                  "required": ["subject", "role", "state", "at"]
                }
              },
              "declaredNotObserved": {
                "type": "array",
                "items": { "type": "string" },
                "description": "Manifest members with no matching store records (design S6)."
              },
              "tickets": {
                "type": "array",
                "items": { "type": "string" },
                "description": "#28 (clickable provenance): the manifest's own declared ticket refs (manifest.tickets, schema/starcar-manifest.schema.json), e.g. [\"#28\", \"#12\"] - never re-parsed from title prose. Absent/empty when the manifest declares none."
              }
            },
            "required": ["id", "title", "cars", "declaredNotObserved"]
          }
        }
      },
      "required": ["trains"]
    },
    "gatesPayload": {
      "type": "object",
      "description": "YB-5: the gates lane's data shape.",
      "properties": {
        "gates": {
          "type": "array",
          "items": {
            "type": "object",
            "properties": {
              "name": { "type": "string", "description": "From the member's gate/role declaration." },
              "subject": { "type": "string" },
              "outcome": { "type": "string", "description": "VERBATIM - the gate's raw recorded outcome, never re-derived." },
              "at": { "type": "string" },
              "recordDir": {
                "type": "string",
                "description": "#28 (clickable provenance): same convention as trainsPayload's car.recordDir - this gate's returned record's directory, relative to the store root."
              },
              "findings": {
                "type": "string",
                "description": "#12 (car health bar): the returned record's own findings field, VERBATIM free text. The view's findings.js module parses a conservative Major/Minor count out of it CLIENT-SIDE (unrecognised shapes render UNKNOWN, never a guessed count). Absent when this gate has no returned record yet."
              }
            },
            "required": ["name", "subject", "outcome", "at"]
          }
        }
      },
      "required": ["gates"]
    },
    "dispatchesPayload": {
      "type": "object",
      "description": "YB-5: the dispatches lane's data shape - mirrors the fold's dispatch entry shape (schema/vectors/fold/ owns that shape) plus assigned: boolean per entry (yard inventory = unassigned, rendered loudly).",
      "properties": {
        "dispatches": {
          "type": "array",
          "items": {
            "type": "object",
            "properties": {
              "subject": { "type": "string" },
              "state": { "type": "string" },
              "at": { "type": "string" },
              "outcome": { "type": "string" },
              "superseded": { "type": "array" },
              "elapsed_seconds": { "type": "integer" },
              "budget_seconds": { "type": "integer" },
              "budget_source": { "type": "string", "description": "Car 4 fix, folded same-commit (docs/plans/2026-07-23-yard-board-plan.md task 4.2): board/fold's shop-default budget threading (spec Amendment 2, issue #22) added this field to fold.DispatchEntry AFTER this $def first landed (Car 2, task 2.2); this schema had no slot for it even though the fold has emitted it since Car 3. Present only alongside a non-null budget_seconds - 'record' or 'default', disclosing which patience produced the rendered state (never a phantom source for a null budget)." },
              "spend": {},
              "assigned": { "type": "boolean", "description": "Yard inventory (unassigned) renders loudly, never silently." },
              "recordDir": {
                "type": "string",
                "description": "#28 (clickable provenance): same convention as trainsPayload's car.recordDir - this dispatch subject's record directory, relative to the store root."
              }
            },
            "required": ["subject", "state", "at", "assigned"]
          }
        }
      },
      "required": ["dispatches"]
    }
  },
  "type": "object",
  "properties": {
    "seq": { "type": "integer", "description": "Monotonic, assigned AFTER change detection (design rev 5 section 5.6 carry of rev 3 rules). The client applies a snapshot only if seq exceeds the last applied." },
    "asOf": {
      "type": ["string", "null"],
      "description": "Most recent SUCCESSFUL store scan; null only if none has ever succeeded."
    },
    "config": {
      "type": "object",
      "properties": {
        "pollMs": { "type": "integer" },
        "heartbeatMs": { "type": "integer", "description": "Travels here so the client never hardcodes it; two missed heartbeats flip the client to disconnected." },
        "stalenessMs": { "type": "integer" },
        "storePathDisplay": { "type": "string", "description": "CWD-relative or home-collapsed - NEVER a raw absolute path (normalisation law; this repo publishes screenshots)." },
        "laneCount": { "type": "integer", "description": "Completeness guard 3: 'registry declares N lanes' renders in chrome." },
        "demoMode": { "type": "boolean", "description": "True exactly when serving a demo fixture store (spec YB-15). Sole consumer: the view's persistent DEMO banner - a disclosure. No truth surface may branch on this field (gating-matrix; the design retired demo-mode suppression)." },
        "githubRepoUrl": {
          "type": "string",
          "description": "#28 (clickable provenance): the base GitHub repo URL (e.g. \"https://github.com/polecatspeaks/StarCar\"), or absent/empty when STARCAR_GITHUB_REPO is unconfigured - a non-GitHub yard degrades to zero provenance links, never a broken one (Law 7: no hardcoded repo identity)."
        },
        "githubRef": {
          "type": "string",
          "description": "#28: the branch a record/tree link resolves against (STARCAR_GITHUB_REF, default \"dev\" - this repo's own working-integration branch)."
        },
        "githubArtifactsPrefix": {
          "type": "string",
          "description": "#28: the configured store's path RELATIVE TO THE REPO ROOT (e.g. \"artifacts\"), or absent/empty when it could not be resolved. Combine as githubRepoUrl + \"/tree/\" + githubRef + \"/\" + githubArtifactsPrefix + \"/\" + a car/gate/dispatch entry's own recordDir to build its full GitHub tree link."
        }
      },
      "required": ["pollMs", "heartbeatMs", "stalenessMs", "storePathDisplay", "laneCount", "demoMode"]
    },
    "vocabularies": {
      "type": "object",
      "description": "Presentational defs travel on EVERY snapshot so the view never hardcodes one and no separately fetched copy can drift (Law 6). Recognition VALUES stay owned by schema/vocab/*.json; these defs add label+register presentation. A value with no def renders by raw id through the detector path.",
      "properties": {
        "positions": { "type": "array", "items": { "$ref": "#/$defs/vocabDef" } },
        "outcomes": { "type": "array", "items": { "$ref": "#/$defs/vocabDef" } },
        "roles": { "type": "array", "items": { "$ref": "#/$defs/vocabDef" } },
        "liveness": { "type": "array", "items": { "$ref": "#/$defs/vocabDef" }, "description": "Defs for the fold's closed liveness states (dispatched/overdue/returned/presumed-lost) - the STATES are mechanism-closed; their presentation is still data." }
      },
      "required": ["positions", "outcomes", "roles", "liveness"]
    },
    "board": { "type": "array", "items": { "$ref": "#/$defs/boardCondition" } },
    "lanes": { "type": "array", "items": { "$ref": "#/$defs/lane" } }
  },
  "required": ["seq", "asOf", "config", "vocabularies", "board", "lanes"]
}
