{"seq":3,"asOf":"2026-07-23T18:14:46Z","config":{"pollMs":1000,"heartbeatMs":5000,"stalenessMs":15000,"storePathDisplay":"<repo>/artifacts","laneCount":5,"demoMode":false},"vocabularies":{"positions":[{"id":"live","label":"Live","register":"nominal"},{"id":"bagged","label":"Bagged","register":"nominal"},{"id":"dark","label":"Dark","register":"nominal"},{"id":"under-construction","label":"Under construction","register":"in-progress"}],"outcomes":[{"id":"APPROVE","label":"Approve","register":"nominal"},{"id":"APPROVE-WITH-REBASE-LIST","label":"Approve (with rebase list)","register":"nominal"},{"id":"REJECT","label":"Reject","register":"nominal"},{"id":"CONFIRM","label":"Confirm","register":"nominal"},{"id":"done","label":"Done","register":"nominal"},{"id":"honest-stop","label":"Honest stop","register":"nominal"},{"id":"done-with-findings","label":"Done, with findings","register":"in-progress"},{"id":"error","label":"Error","register":"needs-attention"}],"roles":[{"id":"car","label":"Car","register":"nominal"},{"id":"reviewer","label":"Reviewer","register":"nominal"},{"id":"gate","label":"Gate","register":"nominal"}],"liveness":[{"id":"returned","label":"Returned","register":"nominal"},{"id":"dispatched","label":"Dispatched","register":"in-progress"},{"id":"overdue","label":"Overdue","register":"needs-attention"},{"id":"presumed-lost","label":"Presumed lost","register":"needs-attention"}]},"board":[{"code":"record-unrecognised-fields","detail":"a01ab6d06808d2ab4/dispatched-20260723T132029Z.json: record carries 1 unrecognised field(s): model","register":"needs-attention"},{"code":"record-unrecognised-fields","detail":"a093b1df791839bd5/dispatched-20260723T164659Z.json: record carries 1 unrecognised field(s): model","register":"needs-attention"},{"code":"record-unrecognised-fields","detail":"a0ff9e48c78041347/dispatched-20260723T150036Z.json: record carries 1 unrecognised field(s): model","register":"needs-attention"},{"code":"record-unrecognised-fields","detail":"a10f39e071e8e4b7b/dispatched-20260723T140401Z.json: record carries 1 unrecognised field(s): model","register":"needs-attention"},{"code":"record-unrecognised-fields","detail":"a128ea355478cd378/dispatched-20260722T204600Z.json: record carries 1 unrecognised field(s): model","register":"needs-attention"},{"code":"record-unrecognised-fields","detail":"a12fbbe2b1592101a/dispatched-20260722T210803Z.json: record carries 1 unrecognised field(s): model","register":"needs-attention"},{"code":"record-unrecognised-fields","detail":"a184e26ee16e704ae/dispatched-20260723T134529Z.json: record carries 1 unrecognised field(s): model","register":"needs-attention"},{"code":"record-unrecognised-fields","detail":"a21c8b80339f1c8fd/dispatched-20260723T143639Z.json: record carries 1 unrecognised field(s): model","register":"needs-attention"},{"code":"record-unrecognised-fields","detail":"a3a95266490ba928d/dispatched-20260723T141810Z.json: record carries 1 unrecognised field(s): model","register":"needs-attention"},{"code":"record-unrecognised-fields","detail":"a3f05aecaa3d550e2/dispatched-20260722T175541Z.json: record carries 1 unrecognised field(s): model","register":"needs-attention"},{"code":"record-unrecognised-fields","detail":"a4374d0904d8f8534/dispatched-20260723T121527Z.json: record carries 1 unrecognised field(s): model","register":"needs-attention"},{"code":"record-unrecognised-fields","detail":"a44127012b765aa15/dispatched-20260722T215948Z.json: record carries 1 unrecognised field(s): model","register":"needs-attention"},{"code":"record-unrecognised-fields","detail":"a581cde8b292e2378/dispatched-20260723T172909Z.json: record carries 1 unrecognised field(s): model","register":"needs-attention"},{"code":"record-unrecognised-fields","detail":"a5b5e3024cb48da0c/dispatched-20260723T161532Z.json: record carries 1 unrecognised field(s): model","register":"needs-attention"},{"code":"record-unrecognised-fields","detail":"a62054a9e0f804eae/dispatched-20260722T164119Z.json: record carries 1 unrecognised field(s): model","register":"needs-attention"},{"code":"record-unrecognised-fields","detail":"a663c067d1d565f02/dispatched-20260723T114035Z.json: record carries 1 unrecognised field(s): model","register":"needs-attention"},{"code":"record-unrecognised-fields","detail":"a83a3fefd4659985e/dispatched-20260722T163957Z.json: record carries 1 unrecognised field(s): model","register":"needs-attention"},{"code":"record-unrecognised-fields","detail":"aa93fdf486b9ff91b/dispatched-20260723T124702Z.json: record carries 1 unrecognised field(s): model","register":"needs-attention"},{"code":"record-unrecognised-fields","detail":"ab533387b9d497ac7/dispatched-20260722T224048Z.json: record carries 1 unrecognised field(s): model","register":"needs-attention"},{"code":"record-unrecognised-fields","detail":"ac32f4e635f031ebe/dispatched-20260722T165856Z.json: record carries 1 unrecognised field(s): model","register":"needs-attention"},{"code":"record-unrecognised-fields","detail":"ac7d81bda8f23f2a6/dispatched-20260723T110647Z.json: record carries 1 unrecognised field(s): model","register":"needs-attention"},{"code":"record-unrecognised-fields","detail":"ac99647694fc5795c/dispatched-20260722T221803Z.json: record carries 1 unrecognised field(s): model","register":"needs-attention"},{"code":"record-unrecognised-fields","detail":"acc25b07aa67ecf2c/dispatched-20260723T122828Z.json: record carries 1 unrecognised field(s): model","register":"needs-attention"},{"code":"record-unrecognised-fields","detail":"acc761f0add2b0af2/dispatched-20260723T105708Z.json: record carries 1 unrecognised field(s): model","register":"needs-attention"},{"code":"record-unrecognised-fields","detail":"accbde6200eebcfc4/dispatched-20260723T150753Z.json: record carries 1 unrecognised field(s): model","register":"needs-attention"},{"code":"record-unrecognised-fields","detail":"ad224da7ad28ced57/dispatched-20260722T231004Z.json: record carries 1 unrecognised field(s): model","register":"needs-attention"},{"code":"record-unrecognised-fields","detail":"ad3eddb772ccb7a93/dispatched-20260722T172453Z.json: record carries 1 unrecognised field(s): model","register":"needs-attention"},{"code":"record-unrecognised-fields","detail":"ae55c4d7156cb410b/dispatched-20260723T154014Z.json: record carries 1 unrecognised field(s): model","register":"needs-attention"},{"code":"record-unrecognised-fields","detail":"aefe2954995877480/dispatched-20260722T203458Z.json: record carries 1 unrecognised field(s): model","register":"needs-attention"},{"code":"record-unrecognised-fields","detail":"reviews/2026-07-21-design-v0-round1-REJECT.json: record carries 1 unrecognised field(s): body_file","register":"needs-attention"},{"code":"record-unrecognised-fields","detail":"reviews/2026-07-22-car1-review-round1.json: record carries 1 unrecognised field(s): body_file","register":"needs-attention"},{"code":"record-unrecognised-fields","detail":"reviews/2026-07-22-car1-review-round2.json: record carries 1 unrecognised field(s): body_file","register":"needs-attention"},{"code":"record-unrecognised-fields","detail":"reviews/2026-07-22-car2-plan-review-round1.json: record carries 1 unrecognised field(s): body_file","register":"needs-attention"},{"code":"record-unrecognised-fields","detail":"reviews/2026-07-22-car2-plan-review-round2-drill.json: record carries 1 unrecognised field(s): body_file","register":"needs-attention"},{"code":"record-unrecognised-fields","detail":"reviews/2026-07-22-car2-plan-review-round3.json: record carries 1 unrecognised field(s): body_file","register":"needs-attention"},{"code":"record-unrecognised-fields","detail":"reviews/2026-07-22-car2-review-round1.json: record carries 1 unrecognised field(s): body_file","register":"needs-attention"},{"code":"record-unrecognised-fields","detail":"reviews/2026-07-22-car2-review-round2.json: record carries 1 unrecognised field(s): body_file","register":"needs-attention"},{"code":"record-unrecognised-fields","detail":"reviews/2026-07-22-car3-plan-review-round1.json: record carries 1 unrecognised field(s): body_file","register":"needs-attention"},{"code":"record-unrecognised-fields","detail":"reviews/2026-07-22-car3-plan-review-round2.json: record carries 1 unrecognised field(s): body_file","register":"needs-attention"},{"code":"record-unrecognised-fields","detail":"reviews/2026-07-22-car3-review-round1.json: record carries 1 unrecognised field(s): body_file","register":"needs-attention"},{"code":"record-unrecognised-fields","detail":"reviews/2026-07-22-design-v0-round2-REJECT.json: record carries 1 unrecognised field(s): body_file","register":"needs-attention"},{"code":"record-unrecognised-fields","detail":"reviews/2026-07-22-harness-design-round1-REJECT.json: record carries 1 unrecognised field(s): body_file","register":"needs-attention"},{"code":"record-unrecognised-fields","detail":"reviews/2026-07-22-harness-design-round2-REJECT.json: record carries 1 unrecognised field(s): body_file","register":"needs-attention"},{"code":"record-unrecognised-fields","detail":"reviews/2026-07-22-harness-design-round3-REJECT.json: record carries 1 unrecognised field(s): body_file","register":"needs-attention"},{"code":"record-unrecognised-fields","detail":"reviews/2026-07-22-harness-design-round4-REJECT-ESCALATED.json: record carries 1 unrecognised field(s): body_file","register":"needs-attention"},{"code":"record-unrecognised-fields","detail":"reviews/2026-07-22-harness-design-round5-REJECT.json: record carries 1 unrecognised field(s): body_file","register":"needs-attention"},{"code":"record-unrecognised-fields","detail":"reviews/2026-07-22-harness-spec-round1-REJECT.json: record carries 1 unrecognised field(s): body_file","register":"needs-attention"},{"code":"record-unrecognised-fields","detail":"reviews/2026-07-22-harness-spec-round2-DELTA-REJECT.json: record carries 1 unrecognised field(s): body_file","register":"needs-attention"},{"code":"record-unrecognised-fields","detail":"reviews/2026-07-22-harness-spec-round3-